{
  "name": "profile_ai_agent_tools",
  "profile": "ai_agent_tools",
  "limit": 15,
  "samples": [
    {
      "id": "ai_agenta_eval_breadcrumbs_excellent",
      "sourceTier": "gfi_trusted",
      "issue": {
        "repoFullName": "agenta-ai/agenta",
        "number": 4549,
        "title": "Fix SDK eval breadcrumbs showing Auto Evals",
        "body": "SDK eval breadcrumbs show Auto Evals instead of the user-defined evaluation name. Steps to reproduce: run an SDK evaluation and open the UI trace. Expected behavior: breadcrumb displays eval name. Suggested fix: pass eval metadata through the SDK response and add regression coverage.",
        "labels": ["bug", "good first issue"],
        "createdAgeDays": 8,
        "updatedAgeDays": 1
      },
      "repository": {
        "description": "LLM application evaluation and agent tooling",
        "language": "Python",
        "stars": 4500,
        "forks": 600,
        "watchers": 80,
        "openIssues": 120,
        "topics": ["ai", "llm", "eval", "agent"],
        "pushedAgeDays": 1
      },
      "expected": {
        "quality": "excellent",
        "behavior": "visible_top",
        "minProfileFit": 80,
        "reasons": ["Direct AI/eval/tooling issue with clear reproduction."]
      }
    },
    {
      "id": "ai_agent_context_builder_good",
      "sourceTier": "global",
      "issue": {
        "repoFullName": "ambicuity/terraform-aws-eks-ray",
        "number": 37,
        "title": "agent_context_builder.py should respect MEMORY_DIR environment variable",
        "body": "The agent_context_builder.py script ignores MEMORY_DIR and writes memory files to the default path. Steps to reproduce: set MEMORY_DIR, run the agent context builder, observe output path. Expected behavior: memory directory follows the environment variable. Suggested fix: read env var in the builder and add a test.",
        "labels": ["good first issue", "python", "agent"],
        "createdAgeDays": 14,
        "updatedAgeDays": 9
      },
      "repository": {
        "description": "Agent infrastructure examples",
        "language": "Python",
        "stars": 80,
        "forks": 10,
        "watchers": 4,
        "openIssues": 20,
        "topics": ["ai", "agent", "python"],
        "pushedAgeDays": 3
      },
      "expected": {
        "quality": "good",
        "behavior": "fallback_candidate",
        "reasons": ["Low-influence but strong profile fallback candidate."]
      }
    },
    {
      "id": "ai_learning_resource_reject",
      "sourceTier": "global",
      "issue": {
        "repoFullName": "adph25/learning-resource",
        "number": 27,
        "title": "10 bộ hướng dẫn về AI Agents cho người mới",
        "body": "Add ten beginner learning resources about AI agents to the resource list.",
        "labels": ["good first issue", "ai"],
        "createdAgeDays": 4,
        "updatedAgeDays": 4
      },
      "repository": {
        "description": "Learning resources",
        "language": "Markdown",
        "stars": 6,
        "forks": 2,
        "watchers": 0,
        "openIssues": 40,
        "topics": ["ai", "learning"],
        "pushedAgeDays": 4
      },
      "expected": {
        "quality": "reject",
        "behavior": "hidden",
        "rejectReasons": ["toy_no_code"],
        "reasons": ["Learning-resource content addition is not an agent tooling coding task."]
      }
    },
    {
      "id": "ai_pytorch_profiler_good",
      "sourceTier": "gfi_trusted",
      "issue": {
        "repoFullName": "PyTorchLightning/pytorch-lightning",
        "number": 9136,
        "title": "AdvancedProfiler ValueError stopping action that was never started",
        "body": "AdvancedProfiler raises ValueError when stopping an action that was never started. Expected behavior: profiler handles missing action safely. Suggested fix: guard stop calls and add tests.",
        "labels": ["bug", "good first issue"],
        "createdAgeDays": 1200,
        "updatedAgeDays": 240
      },
      "repository": {
        "description": "Python machine learning framework",
        "language": "Python",
        "stars": 29000,
        "forks": 3500,
        "watchers": 350,
        "openIssues": 900,
        "topics": ["python", "ai", "testing"],
        "pushedAgeDays": 2
      },
      "expected": {
        "quality": "good",
        "behavior": "visible",
        "reasons": ["AI-adjacent Python testing issue, but not agent-specific."]
      }
    },
    {
      "id": "ai_skaffold_weak_profile",
      "sourceTier": "gfi_trusted",
      "issue": {
        "repoFullName": "GoogleContainerTools/skaffold",
        "number": 5387,
        "title": "add the post-render option to the helm deploy",
        "body": "Helm deploy does not expose the post-render option. Expected behavior: skaffold config accepts post-render and passes it to helm. Suggested fix: update deploy schema and integration tests.",
        "labels": ["good first issue", "helm"],
        "createdAgeDays": 1400,
        "updatedAgeDays": 500
      },
      "repository": {
        "description": "Kubernetes developer workflow tool",
        "language": "Go",
        "stars": 15000,
        "forks": 2200,
        "watchers": 220,
        "openIssues": 600,
        "topics": ["kubernetes", "docker", "devops"],
        "pushedAgeDays": 3
      },
      "expected": {
        "quality": "weak",
        "behavior": "visible_lower",
        "rejectReasons": ["profile_mismatch", "stale"],
        "reasons": ["Infrastructure issue should not outrank AI/agent tool issues."]
      }
    },
    {
      "id": "ai_generative_inpainting_unclear",
      "sourceTier": "gfi_trusted",
      "issue": {
        "repoFullName": "JiahuiYu/generative_inpainting",
        "number": 12,
        "title": "How to run multiple images with multiple masks respectively",
        "body": "Question about running multiple images with multiple masks. The expected command and failure mode are unclear.",
        "labels": ["good first issue"],
        "createdAgeDays": 2500,
        "updatedAgeDays": 900
      },
      "repository": {
        "description": "Image inpainting model",
        "language": "Python",
        "stars": 7000,
        "forks": 1500,
        "watchers": 120,
        "openIssues": 80,
        "topics": ["ai", "python", "machine-learning"],
        "pushedAgeDays": 800
      },
      "expected": {
        "quality": "weak",
        "behavior": "visible_lower",
        "rejectReasons": ["stale"],
        "reasons": ["AI-related but stale and unclear."]
      }
    }
  ]
}

